{
  "id": 32,
  "displayName": "Tai Groot üêß",
  "username": "warptux",
  "isBlueVerified": true,
  "followers": 1112,
  "following": 1407,
  "hitPoints": 110,
  "profilePicUrl": "/pfp/32.jpg",
  "bannerPicUrl": "/banner/32.jpg",
  "fullArtUrl": null,
  "tier": "highbie",
  "abilityName": "Pepe Holder's Persistence",
  "abilityDescription": "Tai Groot's eternal devotion to Pepe collectibles somehow grants immunity to originality, making every post a retread of internet memes and developer in-jokes.",
  "attackName": "Retweet Regress",
  "attackDescription": "Tai Groot spam-retweets so much that you forget whether you‚Äôre following an individual or a curated meme board. The attack overwhelms with recycled content and low-effort banter.",
  "attackType": "cringe",
  "attackDamage": 45,
  "weaknessType": "roast",
  "weaknessAmount": 50,
  "resistType": "cringe",
  "resistAmount": 40,
  "description": "Tai Groot displays a highbie tier, giving him moderate to high hit points (110). The profile and tweets show a tendency to heavily retweet popular memes and developer community jokes, often recycling content rather than original posts, hence the 'Pepe Holder's Persistence' ability which ironically mocks their repetitive nature. The attack 'Retweet Regress' pokes fun at their heavy reliance on retweets which, while giving content, lacks originality and impact, fitting the 'cringe' type given the awkward spammy vibe. They are weak to 'roast' attacks‚Äîdirect criticism and biting commentary cuts through their recycled echo chamber. Concurrently, they resist 'cringe' type attacks as they thrive in awkward, meme-heavy environments. No furry or animal content was found besides the penguin in display name emoji, which is insufficient to assign the furry type strictly, so 'cringe' suits the attack type best.",
  "rarity": "Uncommon",
  "holo": false,
  "xId": "2788860991",
  "cardType": "normal"
}