{
  "id": 143,
  "displayName": "jack",
  "username": "bossBDT",
  "isBlueVerified": true,
  "followers": 136,
  "following": 610,
  "hitPoints": 20,
  "profilePicUrl": "/pfp/143.jpg",
  "bannerPicUrl": "/banner/143.jpg",
  "fullArtUrl": null,
  "tier": "nanobie",
  "abilityName": "Senior Stuck Syndrome",
  "abilityDescription": "Jack's ability to stay stubbornly stuck at senior level drains his own motivation while making ambitious startups seem just out of reach.",
  "attackName": "Layoff Lament",
  "attackDescription": "Jack unleashes a torrent of self-pity and bitterness from his trending tweets about getting laid off and fearing getting fired, dealing emotional damage with his perpetual victim vibe.",
  "attackType": "cringe",
  "attackDamage": 20,
  "weaknessType": "drama",
  "weaknessAmount": 15,
  "resistType": "cringe",
  "resistAmount": 10,
  "description": "Hit points are low since Jack's tier is nanobie, indicating a small follower base and modest influence. The ability mocks his stalled career progression and startup struggles. The attack is derived from multiple tweets lamenting layoffs and firings, showing a self-defeating attitude that is cringeworthy. Jack is weak to drama as emotional conflict exposes his fragile state, but somewhat resistant to cringe since he leans heavily into it himself. No furry or other niche types apply as his content is mostly professional and personal rants without diverse thematic elements.",
  "rarity": "Common",
  "holo": false,
  "xId": "455190076",
  "cardType": "normal"
}