{
  "id": 165,
  "displayName": "Nick | Stegopop",
  "username": "Shplops",
  "isBlueVerified": true,
  "followers": 621,
  "following": 1040,
  "hitPoints": 30,
  "profilePicUrl": "/pfp/165.jpg",
  "bannerPicUrl": "/banner/165.jpg",
  "fullArtUrl": null,
  "tier": "lowbie",
  "abilityName": "Dad Jokes Deploy",
  "abilityDescription": "Automatically sprinkles dad humor to deflect serious game dev discussions, ensuring no one takes anything too seriously â€” including himself.",
  "attackName": "Stegopop Snack Snap",
  "attackDescription": "Nick's legendary pizza photo attack blinds opponents with mouthwatering mediocrity and relentless casual bragging about local eats.",
  "attackType": "roast",
  "attackDamage": 15,
  "weaknessType": "drama",
  "weaknessAmount": 20,
  "resistType": "cringe",
  "resistAmount": 15,
  "description": "Tier is lowbie, so HP and damage are modest. Ability mocks the user's lighthearted dad vibe and unserious tone despite being a game/web dev founder. The attack references their popular pizza photo tweet boasting about the best pizza 3 minutes away, showing casual humblebragging. Roast type fits the sarcastic jab at their self-promotion style. Weakness to drama because the user avoids controversy, preferring safe, casual posting. Resistance to cringe reflects comfort with awkward humor and dad jokes. The presence of a cat photo and no furry/anthro content means no furry type is assigned.",
  "rarity": "Common",
  "holo": false,
  "xId": "4581997338",
  "cardType": "normal"
}