{
  "id": 36,
  "displayName": "atulit",
  "username": "atulit_gaur",
  "isBlueVerified": true,
  "followers": 5249,
  "following": 960,
  "hitPoints": 140,
  "profilePicUrl": "/pfp/36.jpg",
  "bannerPicUrl": "/banner/36.jpg",
  "fullArtUrl": null,
  "tier": "ultrabie",
  "abilityName": "Founder Flex",
  "abilityDescription": "atulit's ability to randomly drop startup and tech jargon leaves opponents confused and marveling at buzzwords they barely understand.",
  "attackName": "Quantquake",
  "attackDescription": "atulit's signature move hits hard with a barrage of cryptic tech buzz and sudden existential questions about quantum fields and neural networks, leaving foes baffled and overwhelmed by the intellectual chaos.",
  "attackType": "psyop",
  "attackDamage": 75,
  "weaknessType": "drama",
  "weaknessAmount": 60,
  "resistType": "psyop",
  "resistAmount": 50,
  "description": "Given atulit's profile as a tech founder who mixes deep tech thoughts with casual, meme-like tweets and often posts confusing or abstract commentary (e.g., quantum fields, AI concepts), the ability and attack focus on his tendency to overwhelm and confuse followers under the guise of intellectualism, making 'psyop' the fitting attack type. The attack damage is strong because he occasionally goes viral and his tweets have decent traction. His resistance to psyop attacks reflects his comfort operating in confusing, complex intellectual territory. However, his weakness is 'drama' since his posts sometimes attract or involve emotional replies and investor hype, making emotional conflicts his Achilles heel.",
  "rarity": "Rare",
  "holo": false,
  "xId": "1557398638917472257",
  "cardType": "normal"
}