{
  "id": 279,
  "displayName": "solst/ICE",
  "username": "IceSolst",
  "isBlueVerified": true,
  "followers": 15269,
  "following": 1532,
  "hitPoints": 180,
  "profilePicUrl": "/pfp/279.jpg",
  "bannerPicUrl": "/banner/279.jpg",
  "fullArtUrl": "/fullArt/IceSolst_279.png",
  "tier": "megabie",
  "abilityName": "Unblockable Expertise",
  "abilityDescription": "Solst/ICE’s tweets are so technical and precise that no misinformation or ignorance can penetrate their defenses, blocking all low-effort arguments.",
  "attackName": "Block Chain Reaction",
  "attackDescription": "solst/ICE unleashes a devastating rant dismantling blockchain misconceptions with relentless technical jargon, leaving opponents overwhelmed and confused.",
  "attackType": "psyop",
  "attackDamage": 110,
  "weaknessType": "roast",
  "weaknessAmount": 90,
  "resistType": "psyop",
  "resistAmount": 110,
  "description": "Given solst/ICE’s megabie tier, high follower count, and highly technical and critical content primarily focused on cybersecurity, software design, and debunking tech myths, they deserve high hit points and a strong psyop attack type, representing their intellectual dominance and confusion-inducing technical critiques. Their ability ironically mocks their expertise as being 'unblockable,' reflecting their tendency to shut down misinformation. The attack, 'Block Chain Reaction,' directly references their viral tweet ridiculing blockchain misconceptions. They resist psyop attacks due to their clear, logical style but have a weakness to 'roast' attacks that challenge their sharp, confident persona. The user does not post animal or furry-themed content, so furry type was not applied. Instead, the focus was on their sarcastic, critical, and highly specialized tech commentary.",
  "rarity": "Legendary",
  "holo": false,
  "xId": "1853915629876543488",
  "cardType": "fullArt"
}